{
  "schema_version": "0.1.0",
  "registry_id": "tool-registry.agent-v0",
  "registry_version": "0.1.0",
  "registry_scope": "online_static_planning",
  "default_decision": "DENY",
  "created_at": "2026-08-04T10:00:00+08:00",
  "state_owner": "deterministic_control_plane",
  "environment_policy": {
    "test": {
      "execution_mode": "FAKE_ONLY",
      "real_network_allowed": false,
      "real_external_effect_allowed": false
    },
    "shadow": {
      "execution_mode": "RECORDED_OR_FAKE_ONLY",
      "real_network_allowed": false,
      "real_external_effect_allowed": false
    },
    "production": {
      "execution_mode": "DETERMINISTIC_DOMAIN_SERVICE_ONLY",
      "agent_direct_network_allowed": false,
      "agent_direct_database_allowed": false,
      "agent_direct_storage_allowed": false
    }
  },
  "tools": [
    {
      "tool_name": "planning.resolve_ride_object",
      "tool_version": "0.1.0",
      "capability_id": "world.resolve",
      "purpose_code": "resolve_ride_object",
      "input_kind": "ride_object_resolution_request",
      "observation_kind": "ride_object_resolution",
      "effect_scope": "READ",
      "approval_mode": "NONE",
      "execution_owner": "deterministic_domain_plane",
      "provider_access": "NONE",
      "request_deduplication": {
        "mode": "OPTIONAL",
        "identity_field": "tool_call_id",
        "same_tool_call_id_required_for_retry": false
      },
      "reversibility": "NON_EFFECTFUL_REQUEST",
      "data_classifications": ["OPAQUE_REFERENCE", "WORLD_CONTEXT"],
      "model_exposure": {
        "opaque_input_refs_only": true,
        "typed_observation_only": true,
        "raw_provider_payload_exposed": false,
        "exact_coordinates_exposed": false,
        "direct_database_handle_exposed": false,
        "direct_storage_handle_exposed": false
      },
      "timeout_policy": {
        "owner": "deterministic_run_controller",
        "bounded_by_run_deadline": true
      },
      "retry_policy": {
        "owner": "deterministic_run_controller",
        "bounded_by_run_budget": true,
        "model_may_extend": false
      },
      "effect_contract": {
        "produces_external_artifact": false,
        "writes_canonical_world": false,
        "writes_personal_asset": false,
        "produces_session_artifact": false
      }
    },
    {
      "tool_name": "planning.retrieve_rider_context",
      "tool_version": "0.1.0",
      "capability_id": "user_context.read_authorized",
      "purpose_code": "retrieve_rider_context",
      "input_kind": "rider_context_request",
      "observation_kind": "rider_context_packet",
      "effect_scope": "READ",
      "approval_mode": "NONE",
      "execution_owner": "deterministic_domain_plane",
      "provider_access": "NONE",
      "request_deduplication": {
        "mode": "OPTIONAL",
        "identity_field": "tool_call_id",
        "same_tool_call_id_required_for_retry": false
      },
      "reversibility": "NON_EFFECTFUL_REQUEST",
      "data_classifications": ["OPAQUE_REFERENCE", "AUTHORIZED_RIDER_CONTEXT"],
      "model_exposure": {
        "opaque_input_refs_only": true,
        "typed_observation_only": true,
        "raw_provider_payload_exposed": false,
        "exact_coordinates_exposed": false,
        "direct_database_handle_exposed": false,
        "direct_storage_handle_exposed": false
      },
      "timeout_policy": {
        "owner": "deterministic_run_controller",
        "bounded_by_run_deadline": true
      },
      "retry_policy": {
        "owner": "deterministic_run_controller",
        "bounded_by_run_budget": true,
        "model_may_extend": false
      },
      "effect_contract": {
        "produces_external_artifact": false,
        "writes_canonical_world": false,
        "writes_personal_asset": false,
        "produces_session_artifact": false
      }
    },
    {
      "tool_name": "planning.retrieve_world_context",
      "tool_version": "0.1.0",
      "capability_id": "world.read",
      "purpose_code": "retrieve_world_context",
      "input_kind": "world_context_request",
      "observation_kind": "world_fact_packet",
      "effect_scope": "READ",
      "approval_mode": "NONE",
      "execution_owner": "deterministic_domain_plane",
      "provider_access": "NONE",
      "request_deduplication": {
        "mode": "OPTIONAL",
        "identity_field": "tool_call_id",
        "same_tool_call_id_required_for_retry": false
      },
      "reversibility": "NON_EFFECTFUL_REQUEST",
      "data_classifications": ["OPAQUE_REFERENCE", "WORLD_CONTEXT"],
      "model_exposure": {
        "opaque_input_refs_only": true,
        "typed_observation_only": true,
        "raw_provider_payload_exposed": false,
        "exact_coordinates_exposed": false,
        "direct_database_handle_exposed": false,
        "direct_storage_handle_exposed": false
      },
      "timeout_policy": {
        "owner": "deterministic_run_controller",
        "bounded_by_run_deadline": true
      },
      "retry_policy": {
        "owner": "deterministic_run_controller",
        "bounded_by_run_budget": true,
        "model_may_extend": false
      },
      "effect_contract": {
        "produces_external_artifact": false,
        "writes_canonical_world": false,
        "writes_personal_asset": false,
        "produces_session_artifact": false
      }
    },
    {
      "tool_name": "planning.generate_candidate_plans",
      "tool_version": "0.1.0",
      "capability_id": "plan.draft.create",
      "purpose_code": "generate_candidate_plans",
      "input_kind": "candidate_plan_generation_request",
      "observation_kind": "candidate_plan_set",
      "effect_scope": "PROVIDER_QUERY",
      "approval_mode": "EXPLICIT_INTENT",
      "execution_owner": "deterministic_domain_plane",
      "provider_access": "DOMAIN_MEDIATED",
      "request_deduplication": {
        "mode": "REQUIRED_FOR_RETRY",
        "identity_field": "tool_call_id",
        "same_tool_call_id_required_for_retry": true
      },
      "reversibility": "NON_EFFECTFUL_REQUEST",
      "data_classifications": ["OPAQUE_REFERENCE", "SESSION_PLAN"],
      "model_exposure": {
        "opaque_input_refs_only": true,
        "typed_observation_only": true,
        "raw_provider_payload_exposed": false,
        "exact_coordinates_exposed": false,
        "direct_database_handle_exposed": false,
        "direct_storage_handle_exposed": false
      },
      "timeout_policy": {
        "owner": "deterministic_run_controller",
        "bounded_by_run_deadline": true
      },
      "retry_policy": {
        "owner": "deterministic_run_controller",
        "bounded_by_run_budget": true,
        "model_may_extend": false
      },
      "effect_contract": {
        "produces_external_artifact": false,
        "writes_canonical_world": false,
        "writes_personal_asset": false,
        "produces_session_artifact": true
      }
    },
    {
      "tool_name": "planning.revise_plan",
      "tool_version": "0.1.0",
      "capability_id": "plan.draft.revise",
      "purpose_code": "revise_plan",
      "input_kind": "ride_plan_revision_request",
      "observation_kind": "ride_plan_revision",
      "effect_scope": "SESSION",
      "approval_mode": "NONE",
      "execution_owner": "deterministic_domain_plane",
      "provider_access": "NONE",
      "request_deduplication": {
        "mode": "REQUIRED_FOR_RETRY",
        "identity_field": "tool_call_id",
        "same_tool_call_id_required_for_retry": true
      },
      "reversibility": "NON_EFFECTFUL_REQUEST",
      "data_classifications": ["OPAQUE_REFERENCE", "SESSION_PLAN"],
      "model_exposure": {
        "opaque_input_refs_only": true,
        "typed_observation_only": true,
        "raw_provider_payload_exposed": false,
        "exact_coordinates_exposed": false,
        "direct_database_handle_exposed": false,
        "direct_storage_handle_exposed": false
      },
      "timeout_policy": {
        "owner": "deterministic_run_controller",
        "bounded_by_run_deadline": true
      },
      "retry_policy": {
        "owner": "deterministic_run_controller",
        "bounded_by_run_budget": true,
        "model_may_extend": false
      },
      "effect_contract": {
        "produces_external_artifact": false,
        "writes_canonical_world": false,
        "writes_personal_asset": false,
        "produces_session_artifact": true
      }
    },
    {
      "tool_name": "planning.validate_plan",
      "tool_version": "0.1.0",
      "capability_id": "plan.validate",
      "purpose_code": "validate_plan",
      "input_kind": "ride_plan_validation_request",
      "observation_kind": "plan_validation",
      "effect_scope": "READ",
      "approval_mode": "NONE",
      "execution_owner": "deterministic_domain_plane",
      "provider_access": "NONE",
      "request_deduplication": {
        "mode": "OPTIONAL",
        "identity_field": "tool_call_id",
        "same_tool_call_id_required_for_retry": false
      },
      "reversibility": "NON_EFFECTFUL_REQUEST",
      "data_classifications": ["OPAQUE_REFERENCE", "SESSION_PLAN"],
      "model_exposure": {
        "opaque_input_refs_only": true,
        "typed_observation_only": true,
        "raw_provider_payload_exposed": false,
        "exact_coordinates_exposed": false,
        "direct_database_handle_exposed": false,
        "direct_storage_handle_exposed": false
      },
      "timeout_policy": {
        "owner": "deterministic_run_controller",
        "bounded_by_run_deadline": true
      },
      "retry_policy": {
        "owner": "deterministic_run_controller",
        "bounded_by_run_budget": true,
        "model_may_extend": false
      },
      "effect_contract": {
        "produces_external_artifact": false,
        "writes_canonical_world": false,
        "writes_personal_asset": false,
        "produces_session_artifact": false
      }
    },
    {
      "tool_name": "planning.compare_plans",
      "tool_version": "0.1.0",